{
  "title": "14-Week Comprehensive AI PM Roadmap",
  "goal": "Land a FAANG/Top-tier AI PM role by February 23, 2026",
  "startDate": "2025-11-18T00:00:00Z",
  "targetEndDate": "2026-02-23T00:00:00Z",
  "totalDurationWeeks": 14,
  "timeCommitmentPerWeek": "20-25 hours/week",
  "profile": {
    "description": "Technical PM (4 years) with engineering background",
    "experience": "4 years"
  },
  "learningStyle": "Build → Research → Share",
  "coreSkills": [
    {
      "skill": "AI/ML Technical Foundations (LLM & Classical)",
      "description": "LLM fundamentals, RAG, Fine-tuning, Embeddings, Vector DBs, and Classical ML (Supervised/Unsupervised).",
      "relevantWeeks": "Weeks 1-3"
    },
    {
      "skill": "System Design & MLOps",
      "description": "Scalable architecture, Data pipelines, Cloud services (AWS/GCP), Cost optimization, Latency/quality trade-offs.",
      "relevantWeeks": "Weeks 2, 5"
    },
    {
      "skill": "Customer Discovery & AI UX",
      "description": "User interviews, Usability testing, UX for hallucinations/latency, Ethical constraints, User-centered AI design.",
      "relevantWeeks": "Weeks 4, 6"
    },
    {
      "skill": "Product Strategy & Stakeholder Comms",
      "description": "Market analysis, GTM strategy, Pricing, Roadmapping, PRDs, Leadership presentations, Cross-functional alignment.",
      "relevantWeeks": "Weeks 4, 8"
    },
    {
      "skill": "Data, Analytics & Experimentation",
      "description": "North Star metrics, RICE, A/B testing for AI, Analytics logging plans, SQL-based insights.",
      "relevantWeeks": "Weeks 4, 7"
    },
    {
      "skill": "AI Ethics & Responsible AI",
      "description": "Identifying and mitigating bias, fairness, 'red teaming', model cards, data privacy, building user trust.",
      "relevantWeeks": "Weeks 4, 7"
    },
    {
      "skill": "Interview & Career Excellence",
      "description": "Mock interviews (All types), STAR stories, Strategic networking, Resume/Portfolio optimization, Application execution.",
      "relevantWeeks": "Weeks 9-14"
    }
  ],
  "phases": [
    {
      "phaseNumber": 1,
      "title": "BUILD AI PRODUCT & PM FOUNDATION",
      "summary": "Master AI/ML fundamentals, system design, and core PM documentation through hands-on projects.",
      "weekRange": "Weeks 1-4",
      "weeks": [
        {
          "weekNumber": 1,
          "title": "AI Fundamentals & First Product Build",
          "theme": "\"Build to Learn\" - Create your first AI product while learning fundamentals",
          "totalHours": 20,
          "status": "PLANNED",
          "timeBreakdown": {
            "build": 14,
            "research": 4,
            "share": 2
          },
          "buildSection": {
            "hours": 14,
            "projectTitle": "AI-Powered Product Assistant",
            "description": "Build a ChatGPT-style interface for a specific domain. Implement conversation memory. Deploy to Vercel.",
            "technicalStack": [
              "Frontend: Next.js + Tailwind",
              "Backend: Python FastAPI or Node.js",
              "LLM: OpenAI GPT-4 or Claude 3.5 Sonnet",
              "Database: PostgreSQL for conversation history"
            ],
            "deliverables": [
              {
                "description": "Working product with public URL",
                "isCompleted": false
              },
              {
                "description": "GitHub repo with README",
                "isCompleted": false
              },
              {
                "description": "1-Page Product Brief for this idea (defining user, problem, and solution)",
                "isCompleted": false
              }
            ]
          },
          "researchSection": {
            "hours": 4,
            "deepDiveTopics": [
              {
                "description": "LLM architecture & how transformers work (2h)",
                "isCompleted": false,
                "suggestedResources": [
                  {
                    "title": "Andrej Karpathy's \"Intro to Large Language Models\" (YouTube)",
                    "type": "YouTube",
                    "url": "https://www.youtube.com/watch?v=zjkBMFhNj_g"
                  },
                  {
                    "title": "The Illustrated Transformer",
                    "type": "Article",
                    "url": "https://jalammar.github.io/illustrated-transformer/"
                  }
                ],
                "subtasks": [
                  {
                    "description": "Read \"Attention Is All You Need\" paper summary",
                    "isCompleted": false,
                    "suggestedResources": [
                      {
                        "title": "Attention Is All You Need - Paper",
                        "type": "Paper",
                        "url": "https://arxiv.org/abs/1706.03762"
                      },
                      {
                        "title": "The Transformer Family by Lilian Weng",
                        "type": "Article",
                        "url": "https://lilianweng.github.io/posts/2023-01-27-the-transformer-family-v2/"
                      }
                    ]
                  },
                  {
                    "description": "Understand tokenization, context windows, temperature",
                    "isCompleted": false,
                    "suggestedResources": [
                      {
                        "title": "OpenAI Tokenizer Tool",
                        "type": "Tool",
                        "url": "https://platform.openai.com/tokenizer"
                      },
                      {
                        "title": "Temperature and Sampling in LLMs",
                        "type": "Article",
                        "url": "https://lukesalamone.github.io/posts/what-is-temperature/"
                      }
                    ]
                  }
                ]
              },
              {
                "description": "Prompt engineering best practices (2h)",
                "isCompleted": false,
                "suggestedResources": [
                  {
                    "title": "OpenAI Prompt Engineering Guide",
                    "type": "Guide",
                    "url": "https://platform.openai.com/docs/guides/prompt-engineering"
                  },
                  {
                    "title": "Anthropic Prompt Engineering Guide",
                    "type": "Guide",
                    "url": "https://docs.anthropic.com/claude/docs/prompt-engineering"
                  }
                ],
                "subtasks": [
                  {
                    "description": "Study OpenAI/Anthropic prompt guides",
                    "isCompleted": false,
                    "suggestedResources": [
                      {
                        "title": "OpenAI Prompt Engineering Guide",
                        "type": "Guide",
                        "url": "https://platform.openai.com/docs/guides/prompt-engineering"
                      },
                      {
                        "title": "Anthropic Prompt Engineering Guide",
                        "type": "Guide",
                        "url": "https://docs.anthropic.com/claude/docs/prompt-engineering"
                      }
                    ]
                  },
                  {
                    "description": "Learn few-shot learning, chain-of-thought prompting",
                    "isCompleted": false,
                    "suggestedResources": [
                      {
                        "title": "Chain-of-Thought Prompting Paper",
                        "type": "Paper",
                        "url": "https://arxiv.org/abs/2201.11903"
                      },
                      {
                        "title": "Prompt Engineering Guide - LearnPrompting.org",
                        "type": "Guide",
                        "url": "https://learnprompting.org/docs/intro"
                      }
                    ]
                  }
                ]
              }
            ],
            "resources": [
              {
                "title": "Andrej Karpathy's \"Intro to Large Language Models\" (YouTube)",
                "type": "YouTube"
              },
              {
                "title": "OpenAI Prompt Engineering Guide",
                "type": "Guide"
              }
            ]
          },
          "shareSection": {
            "hours": 2,
            "artifactTitle": "LinkedIn Post",
            "artifactDescription": "LinkedIn post: \"Built my first AI product assistant in 2 days - here's what I learned about LLMs\"",
            "details": [
              "Include: Demo video, key insights, technical challenges"
            ],
            "tags": [
              "#AIProducts",
              "#ProductManagement",
              "#BuildInPublic"
            ]
          }
        },
        {
          "weekNumber": 2,
          "title": "System Design & MLOps",
          "theme": "\"Scale It\" - Design systems for millions of users and robust data pipelines",
          "totalHours": 20,
          "status": "PLANNED",
          "timeBreakdown": {
            "build": 10,
            "research": 6,
            "share": 4
          },
          "buildSection": {
            "hours": 10,
            "projectTitle": "System Design for AI Chat Platform",
            "description": "Design architecture for 1M+ concurrent users. Create detailed diagrams. Calculate costs. Design data pipeline for training/fine-tuning.",
            "components": [
              "Load balancing & API gateway",
              "Caching strategy (Redis) to reduce LLM calls",
              "Vector database for RAG (Pinecone/Weaviate)",
              "Monitoring & logging (DataDog/CloudWatch)",
              "Cost optimization strategies",
              "MLOps Data Pipeline"
            ],
            "deliverables": [